internal_revenue_code,description,code,payer,price,inpatient_outpatient,cms_certification_num,code_disambiguator
Px00033510004,HC CHEMO IV INFUSION ADDL HR,96415,CASH PRICE,185.0,BOTH,501309,NONE
Px00035010003,HC CT MAXILLOFACIAL W/O DYE LIMITED,70486,CASH PRICE,1368.0,BOTH,501309,NONE
Px00035010006,HC CT MAXILLOFACIAL/SINUS W/O & W/DYE,70488,CASH PRICE,1755.0,BOTH,501309,NONE
Px00035010007,HC CT SOFT TISSUE NECK W/O DYE,70490,CASH PRICE,1202.0,BOTH,501309,NONE
Px00035010008,HC CT SOFT TISSUE NECK W/DYE,70491,CASH PRICE,1449.0,BOTH,501309,NONE
Px00035010009,HC CT SFT TSUE NCK W/O & W/DYE,70492,CASH PRICE,1572.0,BOTH,501309,NONE
Px00035010010,HC CT ANGIOGRAPHY NECK W/ AND W/O DYE,70498,CASH PRICE,2125.0,BOTH,501309,NONE
Px00035010011,HC CT THORAX W/O DYE,71250,CASH PRICE,1307.0,BOTH,501309,NONE
Px00035010012,HC CT THORAX W/O DYE LUNG SCREENING,NONE,CASH PRICE,1352.0,BOTH,501309,NONE
Px00035010013,HC CT ANGIOGRAPHY CHEST,71275,CASH PRICE,3149.0,BOTH,501309,NONE
Px00035010018,HC CT LWR EXTREMITY W/O&W/DYE,73702,CASH PRICE,2463.0,BOTH,501309,NONE
Px00035010020,HC CT ANGIO LWR EXTR W/O&W/DYE,73706,CASH PRICE,2957.0,BOTH,501309,NONE
Px00035010023,HC CT ANGIO ABDOMEN W/O & W/DYE,74175,CASH PRICE,3016.0,BOTH,501309,NONE
Px00035010024,HC CT ABD & PELVIS W/O CONTRAST,74176,CASH PRICE,2980.0,BOTH,501309,NONE
Px00035010025,HC CT ABDOMEN & PELVIS W/ DYE,74177,CASH PRICE,3983.0,BOTH,501309,NONE
Px00035010030,HC CT ANGIO HEART ARTERIES/GRAFTS W/3D IMAGE,75574,CASH PRICE,1190.0,BOTH,501309,NONE
Px00035010031,HC CT ANGIO ABDOMINAL ARTERIES,75635,CASH PRICE,3301.0,BOTH,501309,NONE
Px00035010034,HC CT SCAN FOLLOW-UP STUDY LIMITED,76380,CASH PRICE,582.0,BOTH,501309,NONE
Px00035010072,HC CT ANGIO ABDOMEN PELVIS,74174,CASH PRICE,5075.0,BOTH,501309,NONE
Px00035110002,HC CT HEAD/BRAIN W/O DYE,70450,CASH PRICE,1195.0,BOTH,501309,NONE
Px00035110007,HC CT HEAD/BRAIN W/DYE,70460,CASH PRICE,1491.0,BOTH,501309,NONE
Px00035110012,HC CT HEAD/BRAIN W/O & W/DYE,70470,CASH PRICE,1901.0,BOTH,501309,NONE
Px00035110014,HC CT ORBIT/EAR/FOSSA W/O DYE,70480,CASH PRICE,1274.0,BOTH,501309,NONE
Px00035110017,HC CT ORBIT/EAR/FOSSA W/DYE,70481,CASH PRICE,1786.0,BOTH,501309,NONE
Px00035110019,HC CT ORBIT/EAR/FOSSA W/O&W/DYE,70482,CASH PRICE,1887.0,BOTH,501309,NONE
Px00035110022,HC CT MAXILLOFACIAL W/O DYE,70486,CASH PRICE,1368.0,BOTH,501309,NONE
Px00035110030,HC CT MAXILLOFACIAL W/DYE,70487,CASH PRICE,1684.0,BOTH,501309,NONE
Px00035110032,HC CT ANGIOGRAPHY HEAD,70496,CASH PRICE,1705.0,BOTH,501309,NONE
Px00035210003,HC CT THORAX W/DYE,71260,CASH PRICE,1513.0,BOTH,501309,NONE
Px00035210006,HC CT THORAX W/O & W/DYE,71270,CASH PRICE,2345.0,BOTH,501309,NONE
Px00035210008,HC CT NECK SPINE W/O DYE,72125,CASH PRICE,1276.0,BOTH,501309,NONE
Px00035210009,HC CT NECK SPINE W/DYE,72126,CASH PRICE,1667.0,BOTH,501309,NONE
Px00035210010,HC CT NECK SPINE W/O & W/DYE,72127,CASH PRICE,1781.0,BOTH,501309,NONE
Px00035210011,HC CT CHEST SPINE W/O DYE,72128,CASH PRICE,1570.0,BOTH,501309,NONE
Px00035210012,HC CT CHEST SPINE W/DYE,72129,CASH PRICE,1708.0,BOTH,501309,NONE
Px00035210013,HC CT CHEST SPINE W/O & W/DYE,72130,CASH PRICE,2044.0,BOTH,501309,NONE
Px00035210014,HC CT LUMBAR SPINE W/O DYE,72131,CASH PRICE,1300.0,BOTH,501309,NONE
Px00035210015,HC CT LUMBAR SPINE W/DYE,72132,CASH PRICE,1460.0,BOTH,501309,NONE
Px00035210016,HC CT LUMBAR SPINE W/O & W/DYE,72133,CASH PRICE,2044.0,BOTH,501309,NONE
Px00035210017,HC CT ANGIOGRAPH PELV W/O&W/DYE,72191,CASH PRICE,2921.0,BOTH,501309,NONE
Px00035210018,HC CT PELVIS W/O DYE,72192,CASH PRICE,1253.0,BOTH,501309,NONE
Px00035210020,HC CT PELVIS W/DYE,72193,CASH PRICE,1444.0,BOTH,501309,NONE
Px00035210024,HC CT PELVIS W/O & W/DYE,72194,CASH PRICE,1764.0,BOTH,501309,NONE
Px00035210029,HC CT UPPER EXTREMITY W/O DYE,73200,CASH PRICE,1434.0,BOTH,501309,NONE
Px00035210030,HC CT LOWER EXTREMITY W/O DYE,73700,CASH PRICE,1215.0,BOTH,501309,NONE
Px00035210031,HC CT UPPER EXTREMITY W/DYE,73201,CASH PRICE,1483.0,BOTH,501309,NONE
Px00035210034,HC CT UPPR EXTREMITY W/O&W/DYE,73202,CASH PRICE,2144.0,BOTH,501309,NONE
Px00035210037,HC CT ANGIO UPR EXTRM W/O&W/DYE,73206,CASH PRICE,2627.0,BOTH,501309,NONE
Px00035210038,HC CT ABDOMEN W/O DYE,74150,CASH PRICE,1520.0,BOTH,501309,NONE
Px00035210040,HC CT LOWER EXTREMITY W/DYE,73701,CASH PRICE,1489.0,BOTH,501309,NONE
Px00035210046,HC CT ABDOMEN W/DYE,74160,CASH PRICE,1813.0,BOTH,501309,NONE
Px00035210047,HC CT ABDOMEN W/O & W/DYE,74170,CASH PRICE,2199.0,BOTH,501309,NONE
Px00035210054,HC CT ABDOMEN & PELVIS W/WO DYE,74178,CASH PRICE,4336.0,BOTH,501309,NONE
Px00035210105,HC CT THORAX W/O DYE F/U LUNG SCREENING,71250,CASH PRICE,1307.0,BOTH,501309,NONE
Px00036010001,HC PAIN ROOM SERVICES LEVEL 1,NONE,CASH PRICE,17.0,BOTH,501309,NONE
Px00036010002,HC PAIN ROOM SERVICES LEVEL 2,NONE,CASH PRICE,17.0,BOTH,501309,NONE
Px00036010003,HC PAIN ROOM SERVICES LEVEL 3,NONE,CASH PRICE,17.0,BOTH,501309,NONE
Px00036010004,HC PAIN ROOM SERVICES LEVEL 4,NONE,CASH PRICE,17.0,BOTH,501309,NONE
Px00036010005,HC PAIN ROOM SERVICES LEVEL 5,NONE,CASH PRICE,17.0,BOTH,501309,NONE
Px00036010080,HC BRONCHOSCOPY W/BIOPSY(S),31625,CASH PRICE,2004.0,BOTH,501309,NONE
Px00036010082,HC BRONCHOSCOPY/NEEDLE BX EACH,31629,CASH PRICE,2004.0,BOTH,501309,NONE
Px00036010084,HC BRONCHOSCOPY/LUNG BX ADDL,31632,CASH PRICE,2004.0,BOTH,501309,NONE
Px00036010090,HC BRONCHOSCOPY CLEAR AIRWAYS,31645,CASH PRICE,2004.0,BOTH,501309,NONE
Px00036010110,HC PUNCTURE DRAINAGE/ASPIRATION OF LESION,10160,CASH PRICE,182.0,BOTH,501309,NONE
Px00036010111,HC DRAINAGE OF BREAST LESION,19000,CASH PRICE,589.0,BOTH,501309,NONE
Px00036010129,HC INJ TENDON ORIGIN/INSERTION,20551,CASH PRICE,336.0,BOTH,501309,NONE
Px00036010130,HC DRAIN/INJECT JOINT/BURSA SMALL W/O ULTRASOUND GUIDANCE,20600,CASH PRICE,336.0,BOTH,501309,NONE
Px00036010131,HC DRAIN/INJECT JOINT/BURSA INTERM  W/O ULTRASOUND GUIDANCE,20605,CASH PRICE,336.0,BOTH,501309,NONE
Px00036010132,HC ASPIRATE/INJ GANGLION CYST,20612,CASH PRICE,336.0,BOTH,501309,NONE
Px00036010146,HC OPERATING ROOM SERVICES LEVEL 1 1ST 30 MINS,NONE,CASH PRICE,2835.0,BOTH,501309,NONE
Px00036010147,HC OPERATING ROOM SERVICES LEVEL 2 1ST 30 MINS,NONE,CASH PRICE,2835.0,BOTH,501309,NONE
Px00036010148,HC OPERATING ROOM SERVICES LEVEL 3 1ST 30 MINS,NONE,CASH PRICE,2835.0,BOTH,501309,NONE
Px00036010149,HC OPERATING ROOM SERVICES LEVEL 4 1ST 30 MINS,NONE,CASH PRICE,2835.0,BOTH,501309,NONE
Px00036010150,HC OPERATING ROOM SERVICES LEVEL 5 1ST 30 MINS,NONE,CASH PRICE,2835.0,BOTH,501309,NONE
Px00036010151,HC OPERATING ROOM SERVICES LEVEL 6 1ST 30 MINS,NONE,CASH PRICE,2835.0,BOTH,501309,NONE
Px00036010152,HC OPERATING ROOM SERVICES LEVEL 7 1ST 30 MINS,NONE,CASH PRICE,2835.0,BOTH,501309,NONE
Px00036010153,HC OPERATING ROOM SERVICES LEVEL 8 1ST 30 MINS,NONE,CASH PRICE,2835.0,BOTH,501309,NONE
Px00036010212,HC OPERATING ROOM SERVICES LEVEL 1 PER MIN,NONE,CASH PRICE,64.0,BOTH,501309,NONE
Px00036010214,HC OPERATING ROOM SERVICES LEVEL 2 PER MIN,NONE,CASH PRICE,64.0,BOTH,501309,NONE
Px00036010216,HC OPERATING ROOM SERVICES LEVEL 3 PER MIN,NONE,CASH PRICE,64.0,BOTH,501309,NONE
Px00036010218,HC OPERATING ROOM SERVICES LEVEL 4 PER MIN,NONE,CASH PRICE,64.0,BOTH,501309,NONE
Px00036010220,HC OPERATING ROOM SERVICES LEVEL 5 PER MIN,NONE,CASH PRICE,64.0,BOTH,501309,NONE
Px00036010222,HC OPERATING ROOM SERVICES LEVEL 6 PER MIN,NONE,CASH PRICE,64.0,BOTH,501309,NONE
Px00036010224,HC OPERATING ROOM SERVICES LEVEL 7 PER MIN,NONE,CASH PRICE,64.0,BOTH,501309,NONE
Px00036010226,HC OPERATING ROOM SERVICES LEVEL 8 PER MIN,NONE,CASH PRICE,64.0,BOTH,501309,NONE
Px00036010343,HC BIOPSY OF PROSTATE,55700,CASH PRICE,1653.0,BOTH,501309,NONE
Px00036010371,HC PAIN ROOM SERVICES LEVEL 6,NONE,CASH PRICE,17.0,BOTH,501309,NONE
Px00036010406,HC DIAGNOSTIC  BONE MARROW BIOPSIES,38221,CASH PRICE,459.0,BOTH,501309,NONE
Px00036010408,HC DX BRONCHOSCOPE/WASH,31622,CASH PRICE,2004.0,BOTH,501309,NONE
Px00036010413,HC COLONOSCOPY DIAGNOSTIC,NONE,CASH PRICE,3527.0,BOTH,501309,NONE
Px00036010493,HC YAG LASAR PROCEDURE,NONE,CASH PRICE,2915.0,BOTH,501309,NONE
Px00036010901,HC AMNIOCENTESIS DIAGNOSTIC,59000,CASH PRICE,289.0,BOTH,501309,NONE
Px00036010965,HC NEWBORN RESUSCITATION,99465,CASH PRICE,417.0,BOTH,501309,NONE
Px00036010969,HC INSERTION PICC W/O IMG GDN 5 YR/>,36569,CASH PRICE,1325.0,BOTH,501309,NONE
Px00036012016,HC ABDOM PARACENTESIS DX/THER W/O IMAGING GUIDANCE^,49082,CASH PRICE,930.0,BOTH,501309,NONE
Px00036100080,HC CORE NEEDLE BX LUNG/MEDIASTINUM PERQ W/IMG CDM,32408,CASH PRICE,2589.0,BOTH,501309,NONE
Px00036110005,HC DECLOT VAD W THROMB AGENT,36593,CASH PRICE,295.0,BOTH,501309,NONE
Px00036110071,HC SPINAL FLUID TAP DIAGNOSTIC,62270,CASH PRICE,142.0,BOTH,501309,NONE
Px00036110072,HC INJECT EPIDURAL PATCH,62273,CASH PRICE,681.0,BOTH,501309,NONE
Px00036110101,HC DIAGNOSTIC BONE MARROW ASPIRATIONS,38220,CASH PRICE,74.0,BOTH,501309,NONE
Px00036110172,HC INSERTION OF HEART ELECTRODE,33210,CASH PRICE,5894.0,BOTH,501309,NONE
Px00036110259,HC INSERTION PICC W/RS&I < 5 YR,36572,CASH PRICE,1158.0,BOTH,501309,NONE
Px00036110260,HC INSERTION PICC W/RS&I 5 YR/>,36573,CASH PRICE,2044.0,BOTH,501309,NONE
Px00036110418,HC INSERT NON-TUNNEL CV CATH > 5,36556,CASH PRICE,1180.0,BOTH,501309,NONE
Px00036110432,HC INSERTION PICC W/O IMG GDN 5 YR/>,36569,CASH PRICE,1325.0,BOTH,501309,NONE
Px00036110440,HC REPLACE CVAD CATH,36580,CASH PRICE,1428.0,BOTH,501309,NONE
Px00036110443,HC COMPLETE REPLACEMENT PICC RS&I,36584,CASH PRICE,1343.0,BOTH,501309,NONE
Px00036110446,HC PERICARDIOCENTESIS W/IMG GUIDANCE WHEN PERFORMED CDM,33016,CASH PRICE,3001.0,BOTH,501309,NONE
Px00036110459,HC PERQ PRCRD DRG GTE 6YR W/O CONGENITAL CAR ANOMALY CDM,33017,CASH PRICE,3001.0,BOTH,501309,NONE
Px00036110461,HC PERQ PRCRD DRG 0-5YR/ANY AGE W/CGEN CAR ANOMALY CDM,33018,CASH PRICE,3001.0,BOTH,501309,NONE
Px00036110462,HC PERQ PERICARDIAL DRG W/INSJ NDWELLG CATH W/CT CDM,33019,CASH PRICE,3001.0,BOTH,501309,NONE
Px00036110481,HC THROMBOLYTIC THERAPY STROKE,37195,CASH PRICE,273.0,BOTH,501309,NONE
Px00036110555,HC APPLICATION OF UNABOOT BIL,29580,CASH PRICE,145.0,BOTH,501309,NONE
Px00036110562,HC DRAIN/INJECT JOINT/BURSA MAJOR JOINT W/O ULTRASOUND GUIDANCE,20610,CASH PRICE,336.0,BOTH,501309,NONE
Px00036110571,HC SPINE SURGERY PROCEDURE,22899,CASH PRICE,4701.0,BOTH,501309,NONE
Px00036110603,HC COMPLEX DRAINAGE WOUND,10180,CASH PRICE,2648.0,BOTH,501309,NONE
Px00036110619,HC INSERT EMERGENCY AIRWAY,31500,CASH PRICE,323.0,BOTH,501309,NONE
Px00036110622,HC INSERTION OF CHEST TUBE,32551,CASH PRICE,704.0,BOTH,501309,NONE
Px00036110629,HC REPAIR BLOOD VESSEL LESION,35226,CASH PRICE,919.0,BOTH,501309,NONE
Px00036110644,HC THROAT SURGERY PROCEDURE,42999,CASH PRICE,150.0,BOTH,501309,NONE
Px00036110683,HC DRAIN BL W/CATH INSERTION,51102,CASH PRICE,2633.0,BOTH,501309,NONE
Px00036110687,HC CYSTOSTOMY TUBE CHANGE,51705,CASH PRICE,251.0,BOTH,501309,NONE
Px00036110688,HC CHANGE OF BLADDER TUBE,51710,CASH PRICE,800.0,BOTH,501309,NONE
Px00036110696,HC PUNCTURE SHUNT TUBE/RESERVOIR ASPIRATION/INJ PX,61070,CASH PRICE,800.0,BOTH,501309,NONE
Px00036110717,HC N BLOCK INJ FEM SINGLE,64447,CASH PRICE,501.0,BOTH,501309,NONE
Px00036110718,HC N BLOCK OTHER PERIPHERAL,64450,CASH PRICE,501.0,BOTH,501309,NONE
Px00036110783,HC INJECTION INTRALESIONAL UP TO & INCLUD 7 LESIONS,11900,CASH PRICE,321.0,BOTH,501309,NONE
Px00036110804,HC CENTRAL LINE INSERTION 36556,36556,CASH PRICE,1180.0,BOTH,501309,NONE
Px00036111071,HC INJECTION AA&/STRD INTERCOSTAL NRV EA ADDL LVL,64421,CASH PRICE,962.0,BOTH,501309,NONE
Px00036111084,HC DELIVERY PLACENTA SEPARATE PROCEDURE^,59414,CASH PRICE,2659.0,BOTH,501309,NONE
Px00036111124,HC THORACENTESIS NEEDLE/CATH PLEURA W/O IMAGING,32554,CASH PRICE,326.0,BOTH,501309,NONE
Px00036111126,HC PERQ DRAINAGE PLEURA INSERT CATH W/O IMAGING,32556,CASH PRICE,691.0,BOTH,501309,NONE
Px00036111216,HC DRAIN/INJ JOINT/BURSA SMALL W/US,20604,CASH PRICE,360.0,BOTH,501309,NONE
Px00036111217,HC DRAIN/INJ JOINT/BURSA INTERMEDIATE W/US,20606,CASH PRICE,360.0,BOTH,501309,NONE
Px00036111218,HC DRAIN/INJ JOINT/BURSA MAJOR W/US,20611,CASH PRICE,360.0,BOTH,501309,NONE
Px00036111222,HC PERQ CERVICOTHORACIC INJECT,22510,CASH PRICE,5007.0,BOTH,501309,NONE
Px00036111223,HC PERQ LUMBOSACRAL INJECTION,22511,CASH PRICE,5007.0,BOTH,501309,NONE
Px00036111224,HC VERTEBROPLASTY ADDL INJECT,22512,CASH PRICE,2503.0,BOTH,501309,NONE
Px00036111242,HC NEG PRESS WND TX UTILIZING DISP NON DME EQUIP<50 SQ CM,97607,CASH PRICE,122.0,BOTH,501309,NONE
Px00036111243,HC NEG PRESS WOUND TX >50 CM,97608,CASH PRICE,214.0,BOTH,501309,NONE
Px00036112010,HC PELVIS/HIP JOINT SURGERY,27299,CASH PRICE,217.0,BOTH,501309,NONE
Px00036113018,HC CYSTOSCOPY PROCEDURE,NONE,CASH PRICE,1017.0,BOTH,501309,NONE
Px00036113066,HC AC WOUND VAC THERAPY <50SQ CM,97605,CASH PRICE,182.0,BOTH,501309,NONE
Px00036113067,HC AC WOUND VAC THERAPY >50SQ CM,97606,CASH PRICE,320.0,BOTH,501309,NONE
Px00036114046,HC INJ INTERLAMINAR CRV/THRC W/O IMG,62320,CASH PRICE,922.0,BOTH,501309,NONE
Px00036114048,HC INJ W/NDL OR CATH PLCMNT EPIDRL L/S  W/IMG,62323,CASH PRICE,922.0,BOTH,501309,NONE
Px00036114049,HC INJ INTRALAMINAR CRV/THRC W/O IMG,62324,CASH PRICE,1162.0,BOTH,501309,NONE
Px00036114050,HC INJ CATH PLCMENT CON'T INFUS OR BOLUS C/T W/IMAG,62325,CASH PRICE,1162.0,BOTH,501309,NONE
Px00036114051,HC INJ INTERLAMINAR LMBR/SAC W/O IMG,62326,CASH PRICE,1162.0,BOTH,501309,NONE
Px00036114052,HC INJ PLACE CATH EPI CON'T INF OR  BOLUS L/S W/IMG,62327,CASH PRICE,1162.0,BOTH,501309,NONE
Px00036114053,HC ENDOSC DCMP 1 SPACE LUM,62380,CASH PRICE,10696.0,BOTH,501309,NONE
Px00036114054,HC INJ INTERLAMINAR LMBR/SAC W/O IMG,62322,CASH PRICE,922.0,BOTH,501309,NONE
Px00036114055,HC INJ W/NDL OR CATH PLCMNT EPIDRL C/T W/IMG,62321,CASH PRICE,922.0,BOTH,501309,NONE
Px00037010116,HC ANESTHESIA GEN BY MIN CDM,NONE,CASH PRICE,30.0,BOTH,501309,NONE
Px00037010117,HC ANESTHESIA IV GA BY MIN CDM,NONE,CASH PRICE,14.0,BOTH,501309,NONE
Px00037010118,HC ANESTHESIA MAC BY MIN CDM,NONE,CASH PRICE,21.0,BOTH,501309,NONE
Px00037010120,HC ANESTHESIA REGIONAL BY MIN CDM,NONE,CASH PRICE,8.0,BOTH,501309,NONE
Px00037010151,HC MOD SED SAME PHYS/QHP INITIAL 15 MINS<5YRS,99151,CASH PRICE,76.0,BOTH,501309,NONE
Px00037010152,HC MOD SED SAME PHYS/QHP INITIAL 15 MINS>5YRS,99152,CASH PRICE,76.0,BOTH,501309,NONE
Px00037010153,HC MOD SED SAME PHYS/QHP EACH ADDL 15 MINS,99153,CASH PRICE,76.0,BOTH,501309,NONE
Px00037010154,HC MOD SED OTHER PHYS/QHP INITIAL 15 MINS<5YRS,99155,CASH PRICE,76.0,BOTH,501309,NONE
Px00037010155,HC MOD SED OTHER PHYS/QHP INITIAL 15MINS >5YRS,99156,CASH PRICE,76.0,BOTH,501309,NONE
Px00037010156,HC MOD SED OTHER PHYS/QHP EACH ADDL 15 MINS,99157,CASH PRICE,196.0,BOTH,501309,NONE
Px00039010002,HC CRYOPRECIPITATE EACH UNIT,P9012,CASH PRICE,72.0,BOTH,501309,NONE
Px00039010015,HC RBC LEUKOREDUCED,P9016,CASH PRICE,156.0,BOTH,501309,NONE
Px00039010018,HC PLATELETS EACH UNIT,P9019,CASH PRICE,80.0,BOTH,501309,NONE
Px00039010022,HC RED BLOOD CELLS UNIT,P9021,CASH PRICE,156.0,BOTH,501309,NONE
Px00039010024,HC WASHED RED BLOOD CELLS UNIT,P9022,CASH PRICE,303.0,BOTH,501309,NONE
Px00039010028,HC PLATELETS IRRADIATED,P9032,CASH PRICE,87.0,BOTH,501309,NONE
Px00039010030,HC PLATELET PHERESIS,P9034,CASH PRICE,551.0,BOTH,501309,NONE
Px00039010031,HC PLATELET PHERESIS LEUKOREDUCED,P9035,CASH PRICE,508.0,BOTH,501309,NONE
Px00039010032,HC PLATELET PHERESIS IRRADIATED,P9036,CASH PRICE,1281.0,BOTH,501309,NONE
Px00039010033,HC PLATELET PHERESIS LEUKOREDU IRRAD,P9037,CASH PRICE,1057.0,BOTH,501309,NONE
Px00039010034,HC RBC IRRADIATED,P9038,CASH PRICE,63.0,BOTH,501309,NONE
Px00039010043,HC RBC WASHED LEUKOREDUC IRRAD,P9057,CASH PRICE,2020.0,BOTH,501309,NONE
Px00039010045,HC FRESH FROZEN PLASMA FRZ BETWEEN 8-24HOUR,P9059,CASH PRICE,130.0,BOTH,501309,NONE
Px00039010046,HC FRESH FROZEN PLASMA DONOR RETESTED,P9060,CASH PRICE,128.0,BOTH,501309,NONE
Px00039010054,HC CRYOPRECIPITATE EACH UNIT POOLED,P9012,CASH PRICE,51.0,BOTH,501309,NONE
Px00039010055,HC RBC LEUKOREDUCED IRRADIATED,P9040,CASH PRICE,198.0,BOTH,501309,NONE
Px00039010064,"HC PLATELETS, PATHOGEN REDUCED",P9073,CASH PRICE,1057.0,BOTH,501309,NONE
Px00039110001,HC BLOOD TRANSFUSION EA UNIT,36430,CASH PRICE,204.0,BOTH,501309,NONE
Px00040110020,HC SCREENING BREAST TOMOSYNTHESIS BI,77063,CASH PRICE,36.0,BOTH,501309,NONE
Px00040110021,"HC TOMOSYNTHESIS, MAMMO UNI OR BIL DIAGNOSTIC",G0279,CASH PRICE,36.0,BOTH,501309,NONE
Px00040210001,HC ECHO EXAM OF HEAD,76506,CASH PRICE,778.0,BOTH,501309,NONE
Px00040210004,HC US EXAM OF HEAD AND NECK,76536,CASH PRICE,563.0,BOTH,501309,NONE
Px00040210005,HC US EXAM CHEST,76604,CASH PRICE,504.0,BOTH,501309,NONE
Px00040210008,HC US EXAM ABDOMEN COMPLETE,76700,CASH PRICE,606.0,BOTH,501309,NONE
Px00040210009,HC US EXAM PELVIC LIMITED,76857,CASH PRICE,483.0,BOTH,501309,NONE
Px00040210010,HC US RETROPERITONEAL COMPLETE,76770,CASH PRICE,617.0,BOTH,501309,NONE
Px00040210011,HC US RETROPERITONEAL LIMITED,76775,CASH PRICE,530.0,BOTH,501309,NONE
Px00040210012,HC US EXAM KIDNEY TRANSPLANT W/DOPPLER,76776,CASH PRICE,595.0,BOTH,501309,NONE
Px00040210014,HC US OB < 14 WKS SINGLE FETUS,76801,CASH PRICE,724.0,BOTH,501309,NONE
Px00040210015,HC US OB < 14 WKS ADDL FETUS,76802,CASH PRICE,334.0,BOTH,501309,NONE
Px00040210016,HC US OB >= 14 WKS SINGLE FETUS,76805,CASH PRICE,655.0,BOTH,501309,NONE
Px00040210017,HC US OB>= 14 WKS ADDL FETUS,76810,CASH PRICE,788.0,BOTH,501309,NONE
Px00040210018,HC US OB DETAILED SINGLE FETUS,76811,CASH PRICE,697.0,BOTH,501309,NONE
Px00040210020,HC US OB NUCHAL MEASUREMENT 1 GEST,76813,CASH PRICE,511.0,BOTH,501309,NONE
Px00040210021,HC US OB NUCHAL MEASUREMENT ADD GEST,76814,CASH PRICE,247.0,BOTH,501309,NONE
Px00040210022,HC US OB LIMITED FETUS(S),76815,CASH PRICE,546.0,BOTH,501309,NONE
Px00040210023,HC US OB FOLLOW-UP PER FETUS,76816,CASH PRICE,660.0,BOTH,501309,NONE
Px00040210024,HC US OB TRANSVAGINAL,76817,CASH PRICE,594.0,BOTH,501309,NONE
Px00040210025,HC US FETAL BIOPHYS PROFILE W/NST,76818,CASH PRICE,768.0,BOTH,501309,NONE
Px00040210026,HC US FETAL BIOPHYS PROFILE W/O NST,76819,CASH PRICE,459.0,BOTH,501309,NONE
Px00040210033,HC US TRANSVAGINAL NON-OB,76830,CASH PRICE,585.0,BOTH,501309,NONE
Px00040210035,HC US EXAM PELVIC FOLLICLE LIMITED,76857,CASH PRICE,483.0,BOTH,501309,NONE
Px00040210036,HC US EXAM SCROTUM & CONTENTS,76870,CASH PRICE,569.0,BOTH,501309,NONE
Px00040210037,HC US TRANSRECTAL,76872,CASH PRICE,194.0,BOTH,501309,NONE
Px00040210041,HC US EXT NON-VASC COMPLETE,76881,CASH PRICE,206.0,BOTH,501309,NONE
Px00040210043,HC US EXT NON-VASC LIMITED,76882,CASH PRICE,133.0,BOTH,501309,NONE
Px00040210049,HC US GUIDE VASCULAR ACCESS,76937,CASH PRICE,285.0,BOTH,501309,NONE
Px00040210052,HC US GUIDANCE NEEDLE PLACEMENT IMG S&I CDM,76942,CASH PRICE,504.0,BOTH,501309,NONE
Px00040210053,HC ECHO GUIDE FOR AMNIOCENTESIS,76946,CASH PRICE,460.0,BOTH,501309,NONE
Px00040210059,HC US GUIDE INTRAOP,76998,CASH PRICE,714.0,BOTH,501309,NONE
Px00040210061,HC ECHO EXAMINATION PROCEDURE UNLISTED,76999,CASH PRICE,365.0,BOTH,501309,NONE
Px00040210093,HC US EXAM PELVIC COMPLETE,76856,CASH PRICE,669.0,BOTH,501309,NONE
Px00040210097,HC BLADDER SCAN,51798,CASH PRICE,121.0,BOTH,501309,NONE
Px00040210098,HC US URINE CAPACITY MEASURE,51798,CASH PRICE,121.0,BOTH,501309,NONE
Px00040210104,HC US EXAM OF ABDOMEN LIMITED,76705,CASH PRICE,412.0,BOTH,501309,NONE
Px00040210112,HC US EXT NON-VASC AXILLA LIMITED,76882,CASH PRICE,133.0,BOTH,501309,NONE
Px00040210136,HC US UNI BREAST COMPLETE,76641,CASH PRICE,171.0,BOTH,501309,NONE
Px00040210137,HC US UNI BREAST LIMITED,76642,CASH PRICE,171.0,BOTH,501309,NONE
Px00040210142,HC US ABD AORTA SCRN AAA,76706,CASH PRICE,171.0,BOTH,501309,NONE
Px00040210148,HC US ABD TARGET DYNAMIC MICROBUBBLE 1ST LESION,76978,CASH PRICE,377.0,BOTH,501309,NONE
Px00040210149,HC US ABD TARGET DYNAMIC MICROBUBBLE EA ADDL LES,76979,CASH PRICE,282.0,BOTH,501309,NONE
Px00040210150,HC ULTRASOUND ELASTOGRAPHY PARENCHYMA,76981,CASH PRICE,560.0,BOTH,501309,NONE
Px00040210151,HC ULTRASOUND ELASTOGRAPHY FIRST TARGET LESION,76982,CASH PRICE,560.0,BOTH,501309,NONE
Px00040210152,HC ULTRASOUND ELASTOGRAPHY EA ADDL TARGET LESION,76983,CASH PRICE,420.0,BOTH,501309,NONE
Px00040310004,HC MAMMO SCREEN DIGITAL BILAT,77067,CASH PRICE,220.0,BOTH,501309,NONE
Px00040310005,HC MAMMO SCREEN DIGITAL UNILAT INC CAD,77067,CASH PRICE,220.0,BOTH,501309,NONE
Px00041010003,HC INTUBATION,31500,CASH PRICE,323.0,BOTH,501309,NONE
Px00041010004,HC BLOOD SAMPLING CAPILLARY,36416,CASH PRICE,43.0,BOTH,501309,NONE
Px00041010006,HC BLOOD DRAW ARTERIAL PUNCTURE,36600,CASH PRICE,47.0,BOTH,501309,NONE
Px00041010007,HC CARDIOPULMONARY RESUSCITATION,92950,CASH PRICE,810.0,BOTH,501309,NONE
Px00041010008,"HC PULMONARY MECHANICS,( I.E.NIF, VC, RR, VT)",94150,CASH PRICE,70.0,BOTH,501309,NONE
Px00041010009,HC NITROGEN THERAPY HOURLY,94645,CASH PRICE,108.0,BOTH,501309,NONE
Px00041010010,HC EXTERNAL CHEST WALL OSCILLATION VEST THERAPY,94668,CASH PRICE,101.0,BOTH,501309,NONE
Px00041010012,HC PULSE OXIMETRY MULTIPLE DETERMINATIONS,94761,CASH PRICE,86.0,BOTH,501309,NONE
Px00041010013,HC PULSE OXIMETRY NOCTURNAL STUDY,94762,CASH PRICE,249.0,BOTH,501309,NONE
Px00041010014,HC PULSE OXIMETRY STAND ALONE CONT OXIMETER SET UP,94762,CASH PRICE,249.0,BOTH,501309,NONE
Px00041010023,HC MECHANICAL CHEST WALL OSCILL,94669,CASH PRICE,71.0,BOTH,501309,NONE
Px00041010205,HC AEROSOL CONTINUOUS DAILY,94640,CASH PRICE,157.0,BOTH,501309,NONE
Px00041010237,HC NEBULIZER CONTINUOUS SUBSEQUENT HOUR,94645,CASH PRICE,78.0,BOTH,501309,NONE
Px00041010261,HC EXPIRATORY PRESSURE VALVE THERAPY INITIAL,94667,CASH PRICE,130.0,BOTH,501309,NONE
Px00041010263,HC EXPIRATORY PRESSURE VALVE THERAPY SUBSEQUENT,94668,CASH PRICE,101.0,BOTH,501309,NONE
Px00041010275,HC HIGH FLOW THERAPY DAILY,94640,CASH PRICE,157.0,BOTH,501309,NONE
Px00041010290,HC MECHANICAL VENTILATION FIRST DAY,94002,CASH PRICE,1394.0,BOTH,501309,NONE
Px00041010296,HC MECHANICAL VENTILATION SUBSEQUENT DAY,94003,CASH PRICE,2096.0,BOTH,501309,NONE
Px00041010325,HC NONINVASIVE VENTILATION/CPAP FIRST DAY,94660,CASH PRICE,490.0,BOTH,501309,NONE
Px00041010328,HC NONINVASIVE VENTILATION/CPAP SUBSEQUENT DAY,94660,CASH PRICE,490.0,BOTH,501309,NONE
Px00041010331,HC PULM REHAB GROUP,G0239,CASH PRICE,61.0,BOTH,501309,NONE
Px00041010332,"HC PULM REHAB RESP FUNCTION, INDIV",G0238,CASH PRICE,42.0,BOTH,501309,NONE
Px00041010338,HC PERCUSSION VIBRATION POSTURAL DRAINAGE 3 POSITIONS OR LESS,94668,CASH PRICE,101.0,BOTH,501309,NONE
Px00041010340,HC INTRAPULMONARY PERCUSSION VENTILATION THERAPY,94640,CASH PRICE,157.0,BOTH,501309,NONE
Px00041010341,HC PERCUSSION VIBRATPOSTURAL DRAINAGE >4 POSITIONS,94668,CASH PRICE,101.0,BOTH,501309,NONE
Px00041010353,HC SPUTUM INDUCTION,94640,CASH PRICE,114.0,BOTH,501309,NONE
Px00041010363,"HC PULM REHAB STRENGTH/ENDURANCE, INDIV",G0237,CASH PRICE,42.0,BOTH,501309,NONE
Px00041010366,HC HOME CPAP MANAGEMENT DAILY,94660,CASH PRICE,358.0,BOTH,501309,NONE
Px00041010406,HC TRACHEOSTOMY TUBE CHANGE,31502,CASH PRICE,188.0,BOTH,501309,NONE
Px00041210003,HC IPPB,94640,CASH PRICE,114.0,BOTH,501309,NONE
Px00041210004,HC METER DOSE INHALER,94640,CASH PRICE,114.0,BOTH,501309,NONE
Px00041210005,HC NEBULIZER ANTIBIOTICS,94640,CASH PRICE,114.0,BOTH,501309,NONE
Px00041210006,HC NEBULIZER SMALL VOLUME,94640,CASH PRICE,114.0,BOTH,501309,NONE
Px00041210007,HC NEBULIZER PENTAMIDINE,94642,CASH PRICE,172.0,BOTH,501309,NONE
Px00041210008,HC NEBULIZER CONTINUOUS FIRST HOUR,94644,CASH PRICE,108.0,BOTH,501309,NONE
Px00041210009,"HC DEMO AND/OR EVAL OF PATIENT UTILIZATION OF A NEBULIZER,INHALER,IPPB OR AEROSOL DEVICE",94664,CASH PRICE,338.0,BOTH,501309,NONE
Px00041210044,HC NEBULIZER CONTINUOUS EA SUBSEQUENT HOUR,94645,CASH PRICE,78.0,BOTH,501309,NONE
Px00042010003,HC ORTHOTIC/PROSTH MGMT & TRAINING SBSQ ENCTR PER 15MIN,97763,CASH PRICE,66.0,BOTH,501309,NONE
Px00042010010,HC THER IVNTJ COG FUNCJ CNTCT EA ADDL 15 MINUTES CDM,97130,CASH PRICE,201.0,BOTH,501309,NONE
Px00042010011,HC THER IVNTJ COG FUNCJ CNTCT 1ST 15 MINUTES CDM,97129,CASH PRICE,42.0,BOTH,501309,NONE
Px00042010014,HC CRISIS TELEH 97110 THERAPEUTIC EXERCISES EA 15 MIN CDM,97110,CASH PRICE,58.0,BOTH,501309,NONE
Px00042010015,HC CRISIS TELEH 97112 NEUROMUSCUL REEDUCAT EA 15 MIN CDM,97112,CASH PRICE,112.0,BOTH,501309,NONE
Px00042010016,HC CRISIS TELEH 97116 GAIT TRAINING THERAPY EA 15 MIN CDM,97116,CASH PRICE,52.0,BOTH,501309,NONE
Px00042010017,HC CRISIS TELEH 97750 PHYSICAL PERFORMANCE TEST EA 15 MIN,97750,CASH PRICE,75.0,BOTH,501309,NONE
Px00042010018,HC CRISIS TELEH 97760 ORTHOTIC MGMT AND TRAINING EA 15 MIN,97760,CASH PRICE,86.0,BOTH,501309,NONE
Px00042010019,HC CRISIS TELEH 97761 PROSTHETIC TRAINING EA 15 MIN,97761,CASH PRICE,69.0,BOTH,501309,NONE
Px00042010057,"HC OPPS SERVICE,SCHED TEAM CONF 30 MIN PT",G0175,CASH PRICE,74.0,BOTH,501309,NONE
Px00042010072,HC STRAPPING OF CHEST THORAX,29200,CASH PRICE,145.0,BOTH,501309,NONE
Px00042010080,HC APPLICATION OF UNABOOT,29580,CASH PRICE,145.0,BOTH,501309,NONE
Px00042010083,HC APPLY MULTLAY COMPRS LWR LEG - BIL,29581,CASH PRICE,145.0,BOTH,501309,NONE
Px00042010084,HC APPLY MULTLAY COMPRS LWR LEG,29581,CASH PRICE,145.0,BOTH,501309,NONE
Px00042010107,HC RANGE OF MOTION MEASUREMENTS - EXTREMTY/TRUNK,95851,CASH PRICE,91.0,BOTH,501309,NONE
Px00042010108,HC CANALITH REPOSITION PROC,95992,CASH PRICE,74.0,BOTH,501309,NONE
Px00042010110,HC MECHANICAL TRACTION THERAPY,97012,CASH PRICE,79.0,BOTH,501309,NONE
Px00042010113,HC ELECTRIC STIM THER,97014,CASH PRICE,50.0,BOTH,501309,NONE
Px00042010114,HC VASOPNEUMATIC DEVICE THERAPY,97016,CASH PRICE,37.0,BOTH,501309,NONE
Px00042010117,HC WHIRLPOOL THERAPY,97022,CASH PRICE,86.0,BOTH,501309,NONE
Px00042010121,HC INFRARED THERAPY,97026,CASH PRICE,65.0,BOTH,501309,NONE
Px00042010124,"HC ELECTRICAL STIMULATION ATTENDED, EA 15 MIN",97032,CASH PRICE,70.0,BOTH,501309,NONE
Px00042010125,HC IONTOPHORESIS PER 15-MIN,97033,CASH PRICE,57.0,BOTH,501309,NONE
Px00042010126,"HC CONTRAST BATH THERAPY, EA 15 MIN",97034,CASH PRICE,72.0,BOTH,501309,NONE
Px00042010127,"HC ULTRASOUND THERAPY, EA 15 MIN",97035,CASH PRICE,72.0,BOTH,501309,NONE
Px00042010129,HC HYDROTHERAPY,97036,CASH PRICE,228.0,BOTH,501309,NONE
