internal_revenue_code,description,code,payer,price,inpatient_outpatient,cms_certification_num,code_disambiguator
Px00042010153,HC GROUP THERAPEUTIC PROCEDURES,97150,GROSS CHARGE,124.0,BOTH,501309,NONE
Px00042010160,"HC THERAPEUTIC ACTIVITIES, EA 15 MIN",97530,GROSS CHARGE,83.0,BOTH,501309,NONE
Px00042010165,"HC WHEELCHAIR MNGMENT TRAINING, EA 15 MIN",97542,GROSS CHARGE,101.0,BOTH,501309,NONE
Px00042010166,HC RMVL DEVITAL TIS 20 CM/<,97597,GROSS CHARGE,246.0,BOTH,501309,NONE
Px00042010173,HC RMVL DEVITAL TIS ADDL 20 CM<,97598,GROSS CHARGE,252.0,BOTH,501309,NONE
Px00042010182,HC DEBRIDEMENT TISSUE NON SELECTIVE,97602,GROSS CHARGE,368.0,BOTH,501309,NONE
Px00042010188,HC NEG PRESS WOUND TX < 50 CM,97605,GROSS CHARGE,260.0,BOTH,501309,NONE
Px00042010195,HC NEG PRESS WOUND TX > 50 CM,97606,GROSS CHARGE,458.0,BOTH,501309,NONE
Px00042010248,"HC PHYSICAL PERFORMANCE TEST, EA 15 MIN",97750,GROSS CHARGE,108.0,BOTH,501309,NONE
Px00042010264,"HC ORTHOTIC MGMT AND TRAINING, EA 15 MIN",97760,GROSS CHARGE,123.0,BOTH,501309,NONE
Px00042010265,"HC PROSTHETIC TRAINING, EA 15 MIN",97761,GROSS CHARGE,99.0,BOTH,501309,NONE
Px00042010270,HC ELEC STIM OTHER THAN WOUND,G0283,GROSS CHARGE,35.0,BOTH,501309,NONE
Px00042410066,HC PT EVALUATION LOW COMPLEX,97161,GROSS CHARGE,193.0,BOTH,501309,NONE
Px00042410067,HC PT EVALUATION  MOD COMPLEX,97162,GROSS CHARGE,203.0,BOTH,501309,NONE
Px00042410068,HC PT EVALUATION HIGH COMPLEX,97163,GROSS CHARGE,213.0,BOTH,501309,NONE
Px00042410069,HC PT RE-EVALUATION ESTABLISHED PLAN OF CARE,97164,GROSS CHARGE,78.0,BOTH,501309,NONE
Px00042410070,HC CRISIS TELEH 97161 PT EVALUATION LOW COMPLEX CDM,97161,GROSS CHARGE,193.0,BOTH,501309,NONE
Px00042410071,HC CRISIS TELEH 97162 PT EVALUATION  MOD COMPLEX CDM,97162,GROSS CHARGE,203.0,BOTH,501309,NONE
Px00042410072,HC CRISIS TELEH 97163 PT EVALUATION HIGH COMPLEX CDM,97163,GROSS CHARGE,213.0,BOTH,501309,NONE
Px00042410073,HC CRISIS TELEH 97164 PT RE-EVAL ESTAB PLAN OF CARE CDM,97164,GROSS CHARGE,78.0,BOTH,501309,NONE
Px00043010003,HC RANGE OF MOTION MEASUREMENTS - HAND,95852,GROSS CHARGE,123.0,BOTH,501309,NONE
Px00043010004,HC PARAFFIN BATH THERAPY,97018,GROSS CHARGE,82.0,BOTH,501309,NONE
Px00043010005,HC CRISIS TELEH 97535 SELF CARE MGMT TRAINING EA 15 MIN CDM,97535,GROSS CHARGE,90.0,BOTH,501309,NONE
Px00043010007,"HC SENSORY INTEGRATION, EA 15 MIN",97533,GROSS CHARGE,76.0,BOTH,501309,NONE
Px00043010008,"HC SELF CARE MNGMENT TRAINING, EA 15 MIN",97535,GROSS CHARGE,90.0,BOTH,501309,NONE
Px00043010013,HC SELF CARE MNGMENT TRAINING - ADL,97535,GROSS CHARGE,90.0,BOTH,501309,NONE
Px00043010014,"HC COMMUNITY/WORK REINTEGRATION, EA 15 MIN",97537,GROSS CHARGE,93.0,BOTH,501309,NONE
Px00043010047,"HC OPPS SERVICE,SCHED TEAM CONF <10 MIN PT OT",G0175,GROSS CHARGE,29.0,BOTH,501309,NONE
Px00043410045,HC OT EVALUATION LOW COMPLEX,97165,GROSS CHARGE,335.0,BOTH,501309,NONE
Px00043410046,HC OT EVALUATION MOD COMPLEXITY,97166,GROSS CHARGE,345.0,BOTH,501309,NONE
Px00043410047,HC OT EVALUATION HIGH COMPLEX,97167,GROSS CHARGE,355.0,BOTH,501309,NONE
Px00043410048,HC OT RE-EVALUATION ESTABLISHED PLAN OF CARE,97168,GROSS CHARGE,92.0,BOTH,501309,NONE
Px00043410050,HC CRISIS TELEH 97165 OT EVALUATION LOW COMPLEX CDM,97165,GROSS CHARGE,335.0,BOTH,501309,NONE
Px00043410051,HC CRISIS TELEH 97166 OT EVALUATION MOD COMPLEXITY CDM,97166,GROSS CHARGE,345.0,BOTH,501309,NONE
Px00043410052,HC CRISIS TELEH 97167 OT EVALUATION HIGH COMPLEX CDM,97167,GROSS CHARGE,355.0,BOTH,501309,NONE
Px00043410053,HC CRISIS TELEH 97168 OT RE-EVAL ESTAB PLAN OF CARE CDM,97168,GROSS CHARGE,92.0,BOTH,501309,NONE
Px00044010016,HC SPEECH/HEARING THERAPY - INDIV,92507,GROSS CHARGE,87.0,BOTH,501309,NONE
Px00044010024,HC SPEECH/HEARING THERAPY - GRP,92508,GROSS CHARGE,146.0,BOTH,501309,NONE
Px00044010042,HC ORAL FUNCTION THERAPY,92526,GROSS CHARGE,224.0,BOTH,501309,NONE
Px00044010050,HC ORAL SPEECH DEVICE EVAL,92597,GROSS CHARGE,379.0,BOTH,501309,NONE
Px00044010055,HC NON-SPEECH DEVICE SERVICE,92606,GROSS CHARGE,290.0,BOTH,501309,NONE
Px00044010068,HC USE OF SPEECH DEVICE SERVICE - COM,92609,GROSS CHARGE,290.0,BOTH,501309,NONE
Px00044010069,HC ENT PROCEDURE/SERVICE,92700,GROSS CHARGE,77.0,BOTH,501309,NONE
Px00044010074,"HC ASSESSMENT OF APHASIA, PER HOUR",96105,GROSS CHARGE,316.0,BOTH,501309,NONE
Px00044010076,HC DEVELOPMENTAL TEST LIM,96110,GROSS CHARGE,285.0,BOTH,501309,NONE
Px00044010082,HC NEUROBEHAVIORAL STATUS XM PHYS/QHP 1ST HOUR,96116,GROSS CHARGE,130.0,BOTH,501309,NONE
Px00044010083,HC COGNITIVE TEST BY HC PRO PER HR,96125,GROSS CHARGE,323.0,BOTH,501309,NONE
Px00044010126,HC SPEECH SOUND LANG COMPREHEN,92523,GROSS CHARGE,329.0,BOTH,501309,NONE
Px00044010127,HC BEHAVRAL QUALIT ANALYS VOICE,92524,GROSS CHARGE,164.0,BOTH,501309,NONE
Px00044010145,HC CRISIS TELEH 92507 SPEECH/HEARING THERAPY - INDIV CDM,92507,GROSS CHARGE,235.0,BOTH,501309,NONE
Px00044410022,HC EX FOR SPEECH DEVICE RX 1HR,92607,GROSS CHARGE,342.0,BOTH,501309,NONE
Px00044410025,HC EX FOR SPEECH DEVICE RX EA ADDL 30 MIN,92608,GROSS CHARGE,145.0,BOTH,501309,NONE
Px00044410026,HC EVALUATE SWALLOWING FUNCTION,92610,GROSS CHARGE,309.0,BOTH,501309,NONE
Px00044410043,HC MOTION FLUOROSCOPY/SWALLOW,92611,GROSS CHARGE,420.0,BOTH,501309,NONE
Px00044410054,HC ENDOSCOPY SWALLOW TST (FEES),92612,GROSS CHARGE,312.0,BOTH,501309,NONE
Px00044410063,HC EVALUATION OF SPEECH FLUENCY,92521,GROSS CHARGE,195.0,BOTH,501309,NONE
Px00044410064,HC EVALUATE SPEECH PRODUCTION,92522,GROSS CHARGE,158.0,BOTH,501309,NONE
Px00044410070,HC CRISIS TELEH 92521 EVALUATION OF SPEECH FLUENCY CDM,92521,GROSS CHARGE,195.0,BOTH,501309,NONE
Px00044410071,HC CRISIS TELEH 92522 EVALUATE SPEECH PRODUCTION CDM,92522,GROSS CHARGE,158.0,BOTH,501309,NONE
Px00044410072,HC CRISIS TELEH 92523 SPEECH SOUND LANG COMPREHEN CDM,92523,GROSS CHARGE,329.0,BOTH,501309,NONE
Px00044410073,HC CRISIS TELEH 92524 BEHAVRAL QUALIT ANALYS VOICE CDM,92524,GROSS CHARGE,164.0,BOTH,501309,NONE
Px00045000011,HC ED CASIRIVIMAB IMDEVIMAB INFUSION OR INJECTION ADMIN M0243,M0243,GROSS CHARGE,477.0,BOTH,501309,NONE
Px00045001299,HC ED CLOSED TREAT BIG TOE FRACTURE W/O MANIP CDM,28490,GROSS CHARGE,276.0,BOTH,501309,NONE
Px00045010003,HC ED PRESSURIZED/NONPRESSURIZED INHALATION TREATMENT CDM,94640,GROSS CHARGE,164.0,BOTH,501309,NONE
Px00045010024,HC ED DRAINAGE OF NASAL SEPTUM ABSCESS/HEMATOMA CDM,30020,GROSS CHARGE,573.0,BOTH,501309,NONE
Px00045010025,HC ED REMOVE NASAL FOREIGN BODY CDM,30300,GROSS CHARGE,120.0,BOTH,501309,NONE
Px00045010028,HC ED CONTROL OF NOSEBLEED SIMPLE CDM,30901,GROSS CHARGE,197.0,BOTH,501309,NONE
Px00045010030,HC ED CONTROL OF NOSEBLEED COMPLEX CDM,30903,GROSS CHARGE,197.0,BOTH,501309,NONE
Px00045010031,HC ED PUNCTURE ASPIRATION ABSCESS HEMATOMA BULLA/CYST CDM,10160,GROSS CHARGE,261.0,BOTH,501309,NONE
Px00045010049,HC ED ARTHROCENTESIS ASPIR&/INJ SMALL JT/BURSA W/O US CDM,20600,GROSS CHARGE,481.0,BOTH,501309,NONE
Px00045010050,HC ED ARTHROCENTESIS ASPIR&/INJ MAJOR JT/BURSA W/O US CDM,20610,GROSS CHARGE,481.0,BOTH,501309,NONE
Px00045010051,HC ED ASPIRATION&/INJECTION GANGLION CYST ANY LOCATJ CDM,20612,GROSS CHARGE,481.0,BOTH,501309,NONE
Px00045010066,HC ED INTUBATION ENDOTRACHEAL EMERGENCY PROCEDURE CDM,31500,GROSS CHARGE,462.0,BOTH,501309,NONE
Px00045010068,HC ED THORACENTESIS NEEDLE/CATH PLEURA W/O IMAGING CDM,32554,GROSS CHARGE,466.0,BOTH,501309,NONE
Px00045010070,HC ED PERICARDIOCENTESIS INITIAL CDM,33010,GROSS CHARGE,934.0,BOTH,501309,NONE
Px00045010071,HC ED INSJ/RPLCMT TEMP TRANSVNS 1CHMBR ELTRD/PM CATH CDM,33210,GROSS CHARGE,8420.0,BOTH,501309,NONE
Px00045010073,HC ED RPR BLOOD VESSEL DIRECT LOWER EXTREMITY CDM,35226,GROSS CHARGE,1313.0,BOTH,501309,NONE
Px00045010077,HC ED INSJ NON-TUNNELED CENTRAL VENOUS CATH AGE 5 YR/> CDM,36556,GROSS CHARGE,1687.0,BOTH,501309,NONE
Px00045010080,HC ED INSJ PRPH CVC W/O SUBQ PORT/PMP AGE 5 YR/> CDM,36569,GROSS CHARGE,1893.0,BOTH,501309,NONE
Px00045010082,HC ED DECLOT BY THROMBOLYTIC AGENT IMPLANT DEVICE/CATH CDM,36593,GROSS CHARGE,422.0,BOTH,501309,NONE
Px00045010083,HC ED ARTERIAL PUNCTURE WITHDRAWAL BLOOD DX CDM,36600,GROSS CHARGE,68.0,BOTH,501309,NONE
Px00045010084,HC ED THROMBOLYSIS CEREBRAL IV INFUSION CDM,37195,GROSS CHARGE,391.0,BOTH,501309,NONE
Px00045010089,HC ED THROMBOLYSIS CORONARY INTRAVENOUS INFUSION CDM,92977,GROSS CHARGE,524.0,BOTH,501309,NONE
Px00045010094,HC ED CRITICAL CARE FIRST HOUR CDM,99291,GROSS CHARGE,2093.0,BOTH,501309,NONE
Px00045010098,HC ED PROCTOSIGMOIDOSCOPY DX CDM,45300,GROSS CHARGE,1056.0,BOTH,501309,NONE
Px00045010105,HC ED PUNCTURE SHUNT TUBE/RESERVOIR ASPIRATION/INJ PX CDM,61070,GROSS CHARGE,1143.0,BOTH,501309,NONE
Px00045010107,HC ED SPINAL PUNCTURE LUMBAR DIAGNOSTIC CDM,62270,GROSS CHARGE,203.0,BOTH,501309,NONE
Px00045010108,HC ED SPINAL PUNCTURE THER DRAIN CEREBROSPINAL FLUID CDM,62272,GROSS CHARGE,1599.0,BOTH,501309,NONE
Px00045010113,HC ED NASOPHARYNGOSCOPY CDM,92511,GROSS CHARGE,182.0,BOTH,501309,NONE
Px00045010115,HC ED TREATMENT OF MISCARRIAGE CDM,59812,GROSS CHARGE,3799.0,BOTH,501309,NONE
Px00045010118,HC ED VAGINAL DELIVERY ONLY CDM,59409,GROSS CHARGE,4279.0,BOTH,501309,NONE
Px00045010119,HC ED DELIVER PLACENTA CDM,59414,GROSS CHARGE,3799.0,BOTH,501309,NONE
Px00045010123,HC ED TEMP TRANSCUTANEOUS EXT PACING CDM,92953,GROSS CHARGE,488.0,BOTH,501309,NONE
Px00045010130,HC ED SEXUAL ASSAULT EXAM CDM,99284,GROSS CHARGE,933.0,BOTH,501309,NONE
Px00045010139,HC ED TX PELVIC FX W/O MANIP CDM,27197,GROSS CHARGE,519.0,BOTH,501309,NONE
Px00045010140,HC ED CLSD TX PELVIC FX W/MANIP CDM,27198,GROSS CHARGE,519.0,BOTH,501309,NONE
Px00045010143,HC ED BL DRAW < 3 YRS FEM/JUGULAR CDM,36400,GROSS CHARGE,174.0,BOTH,501309,NONE
Px00045010144,HC ED BL DRAW < 3 YRS SCALP VEIN CDM,36405,GROSS CHARGE,48.0,BOTH,501309,NONE
Px00045010145,HC ED BL DRAW < 3 YRS OTHER VEIN CDM,36406,GROSS CHARGE,37.0,BOTH,501309,NONE
Px00045010146,HC ED NON-ROUTINE BL DRAW > 3 YRS CDM,36410,GROSS CHARGE,174.0,BOTH,501309,NONE
Px00045010148,HC ED VEIN ACCESS CUTDOWN < 1 YR CDM,36420,GROSS CHARGE,57.0,BOTH,501309,NONE
Px00045010149,HC ED VEIN ACCESS CUTDOWN > 1 YR CDM,36425,GROSS CHARGE,50.0,BOTH,501309,NONE
Px00045010157,HC ED TREAT THIGH FX GROWTH PLATE CDM,27516,GROSS CHARGE,276.0,BOTH,501309,NONE
Px00045010158,HC ED TREAT KNEE FRACTURE(S) TUBEROSITY CDM,27538,GROSS CHARGE,276.0,BOTH,501309,NONE
Px00045010159,HC ED TREAT KNEE DISLOCATION CDM,27550,GROSS CHARGE,276.0,BOTH,501309,NONE
Px00045010161,HC ED MOD SED SAME PHYS/QHP <5 YRS 1ST 15 MIN CDM,99151,GROSS CHARGE,109.0,BOTH,501309,NONE
Px00045010164,HC ED MOD SED SAME PHYS/QHP 5/>YRS 1ST 15 MIN CDM,99152,GROSS CHARGE,109.0,BOTH,501309,NONE
Px00045010165,HC ED CLOSED TREAT KNEE DISLOCATION W/O ANESTH CDM,27560,GROSS CHARGE,276.0,BOTH,501309,NONE
Px00045010167,HC ED MOD SED SAME PHYS/QHP EA ADDL 15 MIN CDM,99153,GROSS CHARGE,109.0,BOTH,501309,NONE
Px00045010168,HC ED CLOSED TREAT PATELLA DISLOCATION W/ANSETH CDM,27562,GROSS CHARGE,1162.0,BOTH,501309,NONE
Px00045010170,HC ED UNLISTED PROCEDURE FEMUR/KNEE CDM,27599,GROSS CHARGE,311.0,BOTH,501309,NONE
Px00045010171,HC ED DRAIN LOWER LEG LESION DEEP CDM,27603,GROSS CHARGE,3221.0,BOTH,501309,NONE
Px00045010172,HC ED DRAIN LOWER LEG BURSA CDM,27604,GROSS CHARGE,6717.0,BOTH,501309,NONE
Px00045010177,HC ED MOD SED OTH PHYS/QHP 5/>YRS 1ST 15 MIN CDM,99156,GROSS CHARGE,109.0,BOTH,501309,NONE
Px00045010179,HC ED CLOSED TREAT TIBIAL FRACTURE W/MANIPULATION CDM,27752,GROSS CHARGE,3971.0,BOTH,501309,NONE
Px00045010180,HC ED MOD SED OTH PHYS/QHP <5 YRS 1ST 15 MIN CDM,99155,GROSS CHARGE,109.0,BOTH,501309,NONE
Px00045010183,HC ED MOD SED OTHER PHYS/QHP EA ADDL 15 MIN CDM,99157,GROSS CHARGE,281.0,BOTH,501309,NONE
Px00045010185,HC ED CLOSED TX OF MEDIAL MALLEOLUS FRACTURE W/MANIP CDM,27762,GROSS CHARGE,3971.0,BOTH,501309,NONE
Px00045010192,HC ED CLOSED TX OF FIBULA FRACTURE PROX W/O MANIP CDM,27780,GROSS CHARGE,276.0,BOTH,501309,NONE
Px00045010198,HC ED CLOSED TREATMENT OF ANKLE FRACTURE W/O MANIP CDM,27786,GROSS CHARGE,276.0,BOTH,501309,NONE
Px00045010204,HC ED EMERGENCY DEPT VISIT LEVEL I CDM,99281,GROSS CHARGE,216.0,BOTH,501309,NONE
Px00045010207,HC ED EMERGENCY DEPT VISIT LEVEL II CDM,99282,GROSS CHARGE,357.0,BOTH,501309,NONE
Px00045010210,HC ED EMERGENCY DEPT VISIT LEVEL III CDM,99283,GROSS CHARGE,520.0,BOTH,501309,NONE
Px00045010213,HC ED EMERGENCY DEPT VISIT LEVEL IV CDM,99284,GROSS CHARGE,933.0,BOTH,501309,NONE
Px00045010216,HC ED EMERGENCY DEPT VISIT LEVEL V CDM,99285,GROSS CHARGE,1646.0,BOTH,501309,NONE
Px00045010221,HC ED CRITICAL CARE ADDL 30 MIN CDM,99292,GROSS CHARGE,910.0,BOTH,501309,NONE
Px00045010223,HC ED INSJ TEMP NDWELLG BLADDER CATHETER SIMPLE CDM,51702,GROSS CHARGE,116.0,BOTH,501309,NONE
Px00045010227,HC ED CHANGE CYSTOSTOMY TUBE SIMPLE CDM,51705,GROSS CHARGE,359.0,BOTH,501309,NONE
Px00045010228,HC ED CHANGE CYSTOSTOMY TUBE COMPLICATED CDM,51710,GROSS CHARGE,1143.0,BOTH,501309,NONE
Px00045010229,HC ED MEAS POST-VOIDING RESIDUAL URINE&/BLADDER CAP CDM,51798,GROSS CHARGE,173.0,BOTH,501309,NONE
Px00045010238,HC ED FUSION OF FINGER JOINT CDM,26860,GROSS CHARGE,5310.0,BOTH,501309,NONE
Px00045010239,HC ED AMPUTATE FINGER/THUMB SINGLE W/DIRECT CLOSURE CDM,26951,GROSS CHARGE,3164.0,BOTH,501309,NONE
Px00045010245,HC ED PERQ REPLACEMENT GTUBE NOT REQ REVJ GSTRST TRC CDM,43762,GROSS CHARGE,618.0,BOTH,501309,NONE
Px00045010246,HC ED PERQ DILATION XST TRC ENDOUROLOGIC PX W/IMG CDM,43763,GROSS CHARGE,618.0,BOTH,501309,NONE
Px00045010250,HC ED AMPUTATE FINGER/THUMB SINGLE W/LOCAL ADV FLAPS CDM,26952,GROSS CHARGE,3164.0,BOTH,501309,NONE
Px00045010251,HC ED UNLISTED HAND/FINGER SURGERY CDM,26989,GROSS CHARGE,255.0,BOTH,501309,NONE
Px00045010255,HC ED CLOSED TREATMENT COCCYGEAL FRACTURE CDM,27200,GROSS CHARGE,276.0,BOTH,501309,NONE
Px00045010257,HC ED TX THIGH FRACTURE PROX END NECK W/O MANIP CDM,27230,GROSS CHARGE,276.0,BOTH,501309,NONE
Px00045010258,HC ED CLTX INTER/PERI/SUBTROCHANTERIC FEM FX W/O MANJ CDM,27238,GROSS CHARGE,937.0,BOTH,501309,NONE
Px00045010259,HC ED CLTX GREATER TROCHANTERIC FX W/O MANJ CDM,27246,GROSS CHARGE,937.0,BOTH,501309,NONE
Px00045010263,HC ED CLOSED TX HIP DISLOCATION W/O ANESTH CDM,27250,GROSS CHARGE,276.0,BOTH,501309,NONE
Px00045010267,HC ED CLOSED TX HIP DISLOCATION W/ANESTH CDM,27252,GROSS CHARGE,3697.0,BOTH,501309,NONE
Px00045010271,HC ED TX POST HIP ARTHROPLASTY DISLOCATION W/O ANESTH CDM,27265,GROSS CHARGE,311.0,BOTH,501309,NONE
Px00045010275,HC ED TX POST HIP ARTHROPLASTY DISLOCATION W/ANESTH CDM,27266,GROSS CHARGE,2857.0,BOTH,501309,NONE
Px00045010284,HC ED TX FINGER FRACTURE W/PERC FIXATION W/MANIP EACH CDM,26727,GROSS CHARGE,4816.0,BOTH,501309,NONE
Px00045010285,HC ED I&D DEEP ABSC BURSA/HEMATOMA THIGH/KNEE REGION CDM,27301,GROSS CHARGE,3784.0,BOTH,501309,NONE
Px00045010292,HC ED TREATMENT OF THIGH FRACTURE SUPRACNDLR W/O MANIP CDM,27501,GROSS CHARGE,311.0,BOTH,501309,NONE
Px00045010294,HC ED TREATMENT OF THIGH FRACTURE W/MANIPULATION CDM,27502,GROSS CHARGE,3971.0,BOTH,501309,NONE
Px00045010297,HC ED TREAT FEMORAL FRACTURE W/O MANIPULATION CDM,27508,GROSS CHARGE,276.0,BOTH,501309,NONE
Px00045010299,HC ED TREAT KNEE FRACTURE PROXIMAL TIBIAL W/MANIP CDM,27532,GROSS CHARGE,3526.0,BOTH,501309,NONE
Px00045010307,HC ED INSERT NON-TUNNEL CV CATH < 5 YR CDM,36555,GROSS CHARGE,2040.0,BOTH,501309,NONE
Px00045010308,HC ED INSERT NEEDLE BONE CAVITY CDM,36680,GROSS CHARGE,297.0,BOTH,501309,NONE
Px00045010309,HC ED DRAINAGE OF SKIN ABSCESS SIMPLE OR SINGLE CDM,10060,GROSS CHARGE,261.0,BOTH,501309,NONE
Px00045010310,HC ED DRAINAGE OF SKIN ABSCESS COMPLICATED OR MULTIPLE CDM,10061,GROSS CHARGE,261.0,BOTH,501309,NONE
Px00045010311,HC ED DRAINAGE OF PILONIDAL CYST SIMPLE CDM,10080,GROSS CHARGE,261.0,BOTH,501309,NONE
Px00045010312,HC ED DRAINAGE OF PILONIDAL CYST COMPLICATED CDM,10081,GROSS CHARGE,2415.0,BOTH,501309,NONE
Px00045010313,HC ED REMOVE FOREIGN BODY SIMPLE CDM,10120,GROSS CHARGE,508.0,BOTH,501309,NONE
Px00045010314,HC ED REMOVE FOREIGN BODY COMPLICATED CDM,10121,GROSS CHARGE,3130.0,BOTH,501309,NONE
Px00045010316,HC ED DRAINAGE OF HEMA/FLUID CDM,10140,GROSS CHARGE,2415.0,BOTH,501309,NONE
Px00045010317,HC ED COMPLEX DRAINAGE WOUND - CMPLX CDM,10180,GROSS CHARGE,3784.0,BOTH,501309,NONE
Px00045010318,HC ED DEBRIDE INFECTED SKIN CDM,11000,GROSS CHARGE,508.0,BOTH,501309,NONE
Px00045010320,HC ED DEBRIDE SKIN AT FX SITE CDM,11010,GROSS CHARGE,814.0,BOTH,501309,NONE
Px00045010321,HC ED DEB SKIN BONE AT FX SITE CDM,11012,GROSS CHARGE,814.0,BOTH,501309,NONE
Px00045010324,HC ED DEB SUBQ TISSUE 20 SQ CM/< - DEBRIDE SKIN CDM,11042,GROSS CHARGE,162.0,BOTH,501309,NONE
Px00045010325,HC ED DEB MUSC/FASCIA 20 SQ CM/< CDM,11043,GROSS CHARGE,508.0,BOTH,501309,NONE
Px00045010327,HC ED DEB BONE 20 SQ CM/< CDM,11044,GROSS CHARGE,1523.0,BOTH,501309,NONE
Px00045010329,HC ED DEB MUSC/FASCIA ADD-ON CDM,11046,GROSS CHARGE,508.0,BOTH,501309,NONE
Px00045010330,HC ED DEB BONE ADD-ON CDM,11047,GROSS CHARGE,1523.0,BOTH,501309,NONE
Px00045010331,HC ED REMOVAL OF SKIN TAGS CDM,11200,GROSS CHARGE,162.0,BOTH,501309,NONE
Px00045010334,HC ED EXC TR-EXT B9+MARG 0.6-1 CM CDM,11401,GROSS CHARGE,814.0,BOTH,501309,NONE
Px00045010335,HC ED EXC TR-EXT B9+MARG 3.1-4 CM CDM,11404,GROSS CHARGE,3130.0,BOTH,501309,NONE
Px00045010336,HC ED EXC H-F-NK-SP B9+MARG 0.5 < CDM,11420,GROSS CHARGE,1523.0,BOTH,501309,NONE
Px00045010337,HC ED EXC H-F-NK-SP B9+MARG 0.6-1 CDM,11421,GROSS CHARGE,1523.0,BOTH,501309,NONE
Px00045010338,HC ED EXC B9 LESION MRGN XCP SK TG S/N/H/F/G 1.1-2.0CM CDM,11422,GROSS CHARGE,1523.0,BOTH,501309,NONE
Px00045010344,HC ED EXC H-F-NK-SP B9+MARG 2.1-3 CDM,11423,GROSS CHARGE,3130.0,BOTH,501309,NONE
Px00045010345,HC ED EXC H-F-NK-SP B9+MARG 3.1-4 CDM,11424,GROSS CHARGE,3130.0,BOTH,501309,NONE
Px00045010346,HC ED DEBRIDE NAIL 1-5 CDM,11720,GROSS CHARGE,162.0,BOTH,501309,NONE
Px00045010347,HC ED DEBRIDE NAIL 6 OR MORE CDM,11721,GROSS CHARGE,162.0,BOTH,501309,NONE
Px00045010348,HC ED REMOVAL OF NAIL PLATE CDM,11730,GROSS CHARGE,162.0,BOTH,501309,NONE
Px00045010349,HC ED REMOVE NAIL PLATE ADD-ON CDM,11732,GROSS CHARGE,162.0,BOTH,501309,NONE
Px00045010351,HC ED REMOVAL OF NAIL BED CDM,11750,GROSS CHARGE,814.0,BOTH,501309,NONE
Px00045010353,HC ED REPAIR OF NAIL BED CDM,11760,GROSS CHARGE,220.0,BOTH,501309,NONE
Px00045010354,HC ED EXCISION OF NAIL FOLD TOE CDM,11765,GROSS CHARGE,162.0,BOTH,501309,NONE
Px00045010355,HC ED REPAIR SUPERFICL WOUND(S)< 2.5CM SLP NK AX EXGEN TRNK EXTR HND FT CDM,12001,GROSS CHARGE,220.0,BOTH,501309,NONE
Px00045010356,HC ED REPAIR SUPERFICIAL WND(S) 2.6-7.5CM SLP NK AX EXGEN TRNK EXTR HN CDM,12002,GROSS CHARGE,220.0,BOTH,501309,NONE
Px00045010357,HC ED SIMPLE RPR SCALP/NECK/AX/GENIT/TRUNK 7.6-12.5CM CDM,12004,GROSS CHARGE,220.0,BOTH,501309,NONE
Px00045010358,HC ED REPAIR SPRFCL WOUND(S)12.6 TO 20.0CM SLP NK AX EXGEN TRNK EXTR H CDM,12005,GROSS CHARGE,220.0,BOTH,501309,NONE
Px00045010359,HC ED REPAIR SPRFCL WOUND(S) 20.1-30.0CM SLP NK AX EXGEN TRNK EXTR HND CDM,12006,GROSS CHARGE,220.0,BOTH,501309,NONE
Px00045010360,HC ED REPAIR SUPERFICIAL WOUND(S)>30CM SLP NK AX EXGEN TRNK EXTR HND FT CDM,12007,GROSS CHARGE,220.0,BOTH,501309,NONE
Px00045010361,HC ED REPAIR SUPERFICIAL WOUND(S) <2.5 FACE ERS EYLD NSE LPS MUC CDM,12011,GROSS CHARGE,220.0,BOTH,501309,NONE
Px00045010362,HC ED REPAIR SUPERFICIAL WOUND(S) 2.6-5.0CM FACE ERS EYLD NSE LPS MUC CDM,12013,GROSS CHARGE,220.0,BOTH,501309,NONE
Px00045010363,HC ED REPAIR SUPERFICIAL WOUND(S) 5.1 TO 7.5CM FACE ERS EYLD NSE LPS MUC CDM,12014,GROSS CHARGE,220.0,BOTH,501309,NONE
Px00045010364,HC ED REPAIR SUPERFICIAL WOUND(S) 7.6-12.5CM FACE ERS EYLD NSE LPS MUC CDM,12015,GROSS CHARGE,220.0,BOTH,501309,NONE
Px00045010365,HC ED REPAIR SUPERFICIAL WOUND(S) 12.6-20.0CM FACE ERS EYLD NSE LPS MUC CDM,12016,GROSS CHARGE,220.0,BOTH,501309,NONE
Px00045010367,HC ED REPAIR SUPERFICIAL WOUND(S) 20.1-30.0CM FACE ERS EYLD NSE LPS MUC CDM,12017,GROSS CHARGE,220.0,BOTH,501309,NONE
Px00045010369,HC ED REPAIR SUPERFICIAL WOUND(S) > 30.0 CM FACE ERS EYLD NSE LPS MUC CDM,12018,GROSS CHARGE,599.0,BOTH,501309,NONE
Px00045010370,HC ED CLOSURE OF SPLIT WOUND SIMPLE CLOSURE CDM,12020,GROSS CHARGE,599.0,BOTH,501309,NONE
Px00045010371,HC ED CLOSURE OF SPLIT WOUND W/PACKNG CDM,12021,GROSS CHARGE,599.0,BOTH,501309,NONE
Px00045010372,HC ED INTMD WND REPAIR S/TR/EXT UP TO 2.5CM CDM,12031,GROSS CHARGE,599.0,BOTH,501309,NONE
Px00045010373,HC ED INTMD WND REPAIR S/TR/EXT 2.6 TO 7.5CM CDM,12032,GROSS CHARGE,599.0,BOTH,501309,NONE
Px00045010374,HC ED INTMD WND REPAIR S/TR/EXT 7.6 TO 12.5CM CDM,12034,GROSS CHARGE,599.0,BOTH,501309,NONE
Px00045010375,HC ED INTMD WND REPAIR S/TR/EXT 12.6 TO 20.0CM CDM,12035,GROSS CHARGE,599.0,BOTH,501309,NONE
Px00045010376,HC ED INTMD WND REPAIR S/TR/EXT 20.1 TO 30.0CM CDM,12036,GROSS CHARGE,599.0,BOTH,501309,NONE
Px00045010377,HC ED INTMD WND REPAIR S/TR/EXT > 30 CM. CDM,12037,GROSS CHARGE,599.0,BOTH,501309,NONE
Px00045010378,HC ED INTMD WND REPAIR N-HF/GENIT UP TO 2.5CM CDM,12041,GROSS CHARGE,220.0,BOTH,501309,NONE
Px00045010380,HC ED INTMD WND REPAIR N-HG/GENIT 2.6 TO 7.5CM CDM,12042,GROSS CHARGE,599.0,BOTH,501309,NONE
Px00045010381,HC ED INTMD WND REPAIR N-HG/GENIT 7.6 TO 12.5CM CDM,12044,GROSS CHARGE,599.0,BOTH,501309,NONE
Px00045010382,HC ED INTMD WND REPAIR N-HG/GENIT 12.6 TO 20.0CM CDM,12045,GROSS CHARGE,599.0,BOTH,501309,NONE
Px00045010383,HC ED INTMD WND REPAIR N-HG/GENIT 20.1-30.0CM CDM,12046,GROSS CHARGE,599.0,BOTH,501309,NONE
Px00045010384,HC ED INTMD WND REPAIR N-HG/GENIT >30.0CM CDM,12047,GROSS CHARGE,599.0,BOTH,501309,NONE
Px00045010385,HC ED INTMD WND REPAIR FACE/MM <2.5 CM CDM,12051,GROSS CHARGE,599.0,BOTH,501309,NONE
Px00045010386,HC ED INTMD WND REPAIR FACE/MM 2.6 TO 5.0CM CDM,12052,GROSS CHARGE,610.0,BOTH,501309,NONE
Px00045010387,HC ED INTMD WND REPAIR FACE/MM 5.1 TO 7.5CM CDM,12053,GROSS CHARGE,620.0,BOTH,501309,NONE
Px00045010388,HC ED INTMD WND REPAIR FACE/MM 7.5 TO 12.5CM CDM,12054,GROSS CHARGE,630.0,BOTH,501309,NONE
Px00045010389,HC ED INTMD WND REPAIR FACE/MM 12.6 TO 20.0CM CDM,12055,GROSS CHARGE,640.0,BOTH,501309,NONE
Px00045010390,HC ED INTMD WND REPAIR FACE/MM 20.1 TO 30.0CM CDM,12056,GROSS CHARGE,650.0,BOTH,501309,NONE
Px00045010391,HC ED INTMD WND REPAIR FACE/MM >30CM CDM,12057,GROSS CHARGE,660.0,BOTH,501309,NONE
Px00045010392,"HC ED REPAIR OF WOUND OR LESION 1.1 TO 2.5CM COMPLEX, TRUNK CDM",13100,GROSS CHARGE,914.0,BOTH,501309,NONE
Px00045010393,"HC ED REPAIR OF WOUND OR LESION 2.6 TO 7.5CM COMPLEX, TRUNK CDM",13101,GROSS CHARGE,914.0,BOTH,501309,NONE
Px00045010394,"HC ED REPAIR WOUND/LESION ADD-ON EA ADD 5CM COMPLEX, TRUNK CDM",13102,GROSS CHARGE,599.0,BOTH,501309,NONE
Px00045010395,"HC ED REPAIR OF WOUND OR LESION 1.1 TO 2.5CM COMPLEX, SCLP ARM LEG CDM",13120,GROSS CHARGE,599.0,BOTH,501309,NONE
Px00045010396,"HC ED REPAIR OF WOUND OR LESION 2.6 TO 7.5CM COMPLEX, SCLP ARM LEG CDM",13121,GROSS CHARGE,599.0,BOTH,501309,NONE
Px00045010398,"HC ED REPAIR WOUND/LESION ADD-ON 5CM OR LESS COMPLEX, SCLP ARM LEG CDM",13122,GROSS CHARGE,220.0,BOTH,501309,NONE
Px00045010399,HC ED REPAIR COMPLEX F/C/C/M/N/AX/G/H/F 1.1-2.5 CM CDM,13131,GROSS CHARGE,599.0,BOTH,501309,NONE
Px00045010401,HC ED PENILE INJECTION CDM,54235,GROSS CHARGE,359.0,BOTH,501309,NONE
Px00045010402,HC ED SERIAL TONOMETRY EXAM(S) CDM,92100,GROSS CHARGE,142.0,BOTH,501309,NONE
Px00045010406,HC ED RECTUM SURGERY PROCEDURE CDM,45999,GROSS CHARGE,2055.0,BOTH,501309,NONE
Px00045010407,HC ED INCISION OF RECTAL ABSCESS CDM,46040,GROSS CHARGE,4491.0,BOTH,501309,NONE
Px00045010409,HC ED INCISION OF ANAL ABSCESS CDM,46050,GROSS CHARGE,1023.0,BOTH,501309,NONE
Px00045010410,HC ED INCISE EXTERNAL HEMORRHOID CDM,46083,GROSS CHARGE,359.0,BOTH,501309,NONE
Px00045010413,HC ED REMOVAL OF HEMORRHOID CLOT CDM,46320,GROSS CHARGE,4491.0,BOTH,501309,NONE
Px00045010414,HC ED DIAGNOSTIC ANOSCOPY CDM,46600,GROSS CHARGE,111.0,BOTH,501309,NONE
Px00045010415,HC ED ANOSCOPY REMOVE FOR BODY CDM,46608,GROSS CHARGE,1056.0,BOTH,501309,NONE
Px00045010416,HC ED ANOSCOPY CONTROL BLEEDING CDM,46614,GROSS CHARGE,1056.0,BOTH,501309,NONE
Px00045010417,HC ED REMOVE BY LIGAT INT HEM GRP CDM,46945,GROSS CHARGE,4491.0,BOTH,501309,NONE
Px00045010419,HC ED CYSTOSTOMY CYSTOTOMY W DRAINAGE CDM,51040,GROSS CHARGE,5447.0,BOTH,501309,NONE
Px00045010420,HC ED DRAIN BLADDER BY NEEDLE CDM,51100,GROSS CHARGE,359.0,BOTH,501309,NONE
Px00045010423,HC ED IRRIGATION OF BLADDER CDM,51700,GROSS CHARGE,359.0,BOTH,501309,NONE
Px00045010424,HC ED INSERT BLADDER CATH COMPLEX CDM,51703,GROSS CHARGE,204.0,BOTH,501309,NONE
Px00045010430,"HC ED DILATE URETHRA STRICTURE W/ FILIFORM MALE, INITIAL CDM",53620,GROSS CHARGE,3762.0,BOTH,501309,NONE
Px00045010433,HC ED IRRIGATION OF CORPORA CAVERNOSA FOR PRIAPISM CDM,54220,GROSS CHARGE,359.0,BOTH,501309,NONE
Px00045010434,HC ED PREPUTIAL STRETCHING CDM,54450,GROSS CHARGE,587.0,BOTH,501309,NONE
Px00045010437,HC ED DRAINAGE OF SCROTUM ABSCESS CDM,55100,GROSS CHARGE,2415.0,BOTH,501309,NONE
Px00045010440,HC ED I & D OF VULVA/PERINEUM CDM,56405,GROSS CHARGE,291.0,BOTH,501309,NONE
Px00045010441,HC ED DRAINAGE OF GLAND ABSCESS CDM,56420,GROSS CHARGE,291.0,BOTH,501309,NONE
Px00045010442,HC ED SURGERY FOR VULVA LESION CDM,56440,GROSS CHARGE,3799.0,BOTH,501309,NONE
Px00045010443,HC ED DRAINAGE OF PELVIC FLUID CDM,57020,GROSS CHARGE,1243.0,BOTH,501309,NONE
Px00045010445,"HC ED REPAIR OF VAGINA, SUTURE CDM",57200,GROSS CHARGE,4279.0,BOTH,501309,NONE
Px00045010450,HC ED INCISION OF EARDRUM W/O GENERAL ANESTHESIA CDM,69420,GROSS CHARGE,573.0,BOTH,501309,NONE
Px00045010452,HC ED CAUTERIZATION OF CERVIX CDM,57510,GROSS CHARGE,3551.0,BOTH,501309,NONE
Px00045010454,HC ED DILATION AND CURETTAGE CDM,58120,GROSS CHARGE,3799.0,BOTH,501309,NONE
Px00045010455,HC ED REMOVE INTRAUTERINE DEVICE CDM,58301,GROSS CHARGE,291.0,BOTH,501309,NONE
Px00045010459,HC ED NERVE BLOCK INJ TRIGEMINAL CDM,64400,GROSS CHARGE,481.0,BOTH,501309,NONE
Px00045010461,HC ED NERVE BLOCK INJ OCCIPITAL CDM,64405,GROSS CHARGE,717.0,BOTH,501309,NONE
Px00045010462,HC ED NERVE BLOCK INJ INTERCOSTAL SINGLE CDM,64420,GROSS CHARGE,717.0,BOTH,501309,NONE
Px00045010467,HC ED REMOVE FOREIGN BODY FROM EYE SUPERFICIAL CDM,65205,GROSS CHARGE,219.0,BOTH,501309,NONE
